{"schema":"betabots.sanitized-export.v1","id":"export.generic-checkout","allowlistedArtifacts":[{"path":"artifacts/manifest.json","sha256":"aaaaaaaaaaaaaaaaaaaaaaaaaaaaaaaaaaaaaaaaaaaaaaaaaaaaaaaaaaaaaaaa","sizeBytes":120}],"excludedSensitiveClasses":["authentication-state","cookies","tokens"],"schemaVersions":["betabots.study-manifest.v1","betabots.evidence-ref.v1"],"verification":{"authenticationStatesAbsent":true,"cookiesAbsent":true,"tokensAbsent":true}}
